date,cleanText
2018-06-10,"Trade is just that Roadster becomes a 2 seater instead of a 2+2. COPV in place of the kid seats, which is prob wise for many reasons Exactly. Total energy stored even in ultra compressed air is low vs battery, but power output is insane. The composite overwrapped pressure vessel (COPV) is most advanced ever made. It’s what SpaceX is qualifying for NASA crewed missions. Extremely robust — literally bulletproof. Add an R for Roadster Sigh. This is crux of matter: can’t make system too annoying or people won’t use it, negatively affecting safety, but also can’t allow people to get too complacent or safety again suffers. Latest update should have a positive effect on latter issue especially. A lot of people whose judgment I respect have suggested this. Sounds like a good idea. Will do so after Model 3 production reaches 5k/week steady. Correct, pure electric. Wish orbital rockets could be so too, but there’s no escaping Newton’s Third Law. SpaceX is already developing high efficiency CO2 capture with H2O to form liquid CH4 (methane) &amp; O2. Critical for propellant production at Mars Base Alpha. You have my word, Marques. Next gen Roadster will be absolutely out of this world. For those who love to drive, there is no finer car in history and we don’t think there will be another. Intent of new Tesla Roadster is to beat gas sports cars on every performance metric by far, no exceptions, thus transferring the “halo crown” effect gas cars have as the top speed leaders over to pure electric. That issue is better in latest Autopilot software rolling out now &amp; fully fixed in August update as part of our long-awaited Tesla Version 9. To date, Autopilot resources have rightly focused entirely on safety. With V9, we will begin to enable full self-driving features. That’s quite a blast from the past! After my Zip2 experience w patents, I felt that patents (particularly software) inhibited innovation, instead of fostering it. I aspired to file zero patents after that. In 2014, we open-sourced all Tesla patents"
2018-06-12,"Difficult, but necessary Tesla reorg underway. My email to the company has already leaked to media. Here it is unfiltered:"
2018-06-13,We use less than 3% cobalt in our batteries &amp; will use none in next gen
2018-06-15,Already sold &gt;$100M TSLA for charity. Will do about that every few years. Major disbursements in about 20 years when Tesla is steady state.
2018-06-16,I disagree with that goal &amp; gave away Tesla patents to help other companies Amazing work by Tesla team. Built entire new general assembly line in 3 weeks w minimal resources. Love u guys so much! Pic of 1st Model 3 dual motor performance coming off the line …
2018-06-17,"We’ve always provided healthcare, hourly wages above union &amp; Tesla stock. Also, free drinks &amp; snacks. Try to make it fun too. Top ten hourly workers cumulatively received Tesla stock now worth $1M to $2M. Nobody wants UAW, so UAW keeps trashing Tesla &amp; me via 3rd parties. ...which clearly doesn’t work. UAW and Wall Street shorts know every detail of what’s happening at Tesla. Storm clouds are gathering, so they’re getting desperate. More propaganda. The NDA only prevents disclosure of Tesla proprietary IP or material non-public information (insider trading). I endorse freedom to form a union too, as well as freedom not to do so if they feel Tesla is a good company. UAW has major conflicts of interest &amp; failed our car plant already when they abandoned us in 2010. Tesla can only hire 5% of applicants, so must be doing something right. UAW doesn’t have 30% of signatures (about 6000 people) needed for a vote. They can’t even muster enough people for a free bbq. Instead, they’re getting paid trolls &amp; far left shills to trash Tesla &amp; me in press &amp; social media. Such creeps. I’m not against all unions, but UAW has a track record of destroying productivity so a company can’t compete on world market. Our current factory went bankrupt under UAW before we took it over. Don’t want Tesla to die too. Iain certainly wasn’t pro-union in the Culture books. At all. And wouldn’t be in the case of Tesla. Banks was about freedom through &amp; through. Maybe for a single buyer (monopsony) vs single seller (monopoly), I would be too, but that’s a special case. Auto-semiotic asphyxiation (sorry, couldn’t resist) The Semi-erotics of Evil “Profit” just means you earned more money than you spent &amp; certainly does spark innovation. Jesus. This is obv a good thing &amp; extremely hard. It has taken Tesla 15 years &amp; we’re almost there. Every other US car company besides Ford &amp; Tesla has gone bankrupt."
2018-06-18,"Dude, we are California, which is extremely pro union. People can form a union tomorrow &amp; nothing Tesla could do to stop it. UAW can’t even get enough sigs to request a vote, cause they have nothing to offer."
2018-06-19,"To be clear, Tesla European Headquarters will remain in Netherlands You’re probably right. Maybe after Tesla drama calms down. Not sure we actually need a building. This tent is pretty sweet. Tesla Grohmann line is in place at Giga &amp; spooling up now. They super kicked ass too. Heiliger Strohsack! Needed another general assembly line to reach 5k/week Model 3 production. A new building was impossible, so we built a giant tent in 2 weeks. Tesla team kfa!! Gah, love them so much ♥️"
2018-06-20,"There is more, but the actions of a few bad apples will not stop Tesla from reaching its goals. With 40,000 people, the worst 1 in 1000 will have issues. That’s still ~40 people. Thanks for coming by our car factory with . Tesla team was super fired up to see you! Congrats on your victory!!"
2018-06-22,"At Fremont until late tonight, Giga tomorrow, Fremont Sunday. GA4 is great, but have to say that GA3 crew is pulling off miracles against all odds. Was thinking of offering an extended Tesla factory tour option where you could help build part of a car &amp; understand how they come together. I know it would have been super fun for me when I was a kid (or now). It’s actually pretty fun building electric cars. Product is useful to other people &amp; good for environment. I think that’s fundamental goodness."
2018-06-23,Expanding the tour soon. So many cool things to see. Tesla car factory has 3rd largest footprint of any building on Earth. Maybe 1st if you include all our sweet tents ⛺️ Tesla factory rn
2018-06-24,Cyborg Dragon Tesla almost done Tesla Semi Truck in Mad Max Mode
2018-06-25,"This doesn’t take into account shifting trillions of tons of carbon from subsurface to atmosphere, which could accelerate overheating time by a factor of a million (or so). This is why Tesla. Critical autonomous safety features like emergency braking are standard, but convenience features like active cruise control are not It’s a tough call. Reality is that it will be pretty easy to bully a self-driving car, as it will always yield. Will prob have a manual override that requires continuous press for hardcore lane changes."
2018-06-26,"Wow, great idea! Since it will already have a Tesla pneumatics system, it totally makes sense to add a utility port. The Tesla Truck will have dual motor all-wheel drive w crazy torque &amp; a suspension that dynamically adjusts for load. Those will be standard. What would you love to see in a Tesla pickup truck? I have a few things in mind, but what do you think are small, but important nuances &amp; what would be seriously next level? “Virtue signaling” is super annoying &amp; there are lots of phoneys who are actually huge jerks, but jump on every social cause du jour. But I’m really proud of the fact that # of changes Tesla had to make to achieve 100/100 (before even knowing about the LGBTQ index) was zero. Then you will really hate that Tesla scored 100/100 four years in a row on LGBTQ equality"
2018-06-27,"No standard automotive solution could be built in time, so we created a new solution. It is working &amp; has slightly higher quality than the more traditional general assembly line. Perhaps most surprising is that the total cost of production in the Sprung tent is lower. All Tesla vehicles come with cabin overheat protection For sure! When doing US govt crash safety testing, the Model S roof was so strong, it broke their testing machine."
2018-07-01,"7000 cars, 7 days ♥️ Tesla Team ♥️"
2018-07-04,"Very early on, we had the ability to use the car as a battery outputting power. Maybe worth revisiting that."
2018-07-05,"Norwegians are right to be upset with Tesla. We are having trouble expanding our service facilities in Oslo especially. Can solve quickly with Tesla mobile service vans, but awaiting govt permission to do so. Are you 100% certain that stands by &amp; supports everything she’s done? Why won’t Lopez go on record saying that she never offered Tripp anything for inside info or asked him to break his confidentiality agreement by taking detailed video of Tesla IP? So publicly stated she stans for Chanos, Tesla’s most prominent short-seller. In her words, he is “one of the greatest.” Her articles print Chanos’s view verbatim. This is not journalism. . You stated publicly that you “see eye to eye” with Chanos, the most prominent short-seller of Tesla. Have you ever provided him with material non-public information about Tesla? Indeed, very simple question. To be specific: , did you compensate or promise to compensate Martin Tripp for inside information about Tesla? Did he, under that inducement, provide you with exaggerated negative info, which you printed, but turned out to be untrue? Sounds very sketchy if true. , is it possible you’re serving as an inside trading source for one of Tesla’s biggest short-sellers? An ex-Tesla employee just went on record formally claiming you bribed him &amp; he sent you valuable Tesla IP in exchange. Is this true? Wow, so of wrote article that misled public about Model 3 production &amp; followed that up with mean tweet to me on my bday. Nice work &amp; . . is relentlessly negative about Tesla. They just wrote a bogus article saying S production last week was low by 800 cars. S/X annual prod is set at ~100k, ie 1,900/week. Tesla built 1,913 S/X cars at our standard ~50/50 split last week, which is right on target. has published several false articles about Tesla, including a doozy where she claimed Tesla scrapped more batteries than our total S,X &amp;3 production number, which is physically impossible."
2018-07-06,"Does you know output voltage &amp; amperage of those generator trucks? 3 phase? What frequency? Will need high voltage transformer to carry power over distance or very thick cable. Beyond that, only batteries will work. Will prep Powerwalls in case needed. Looks like 1st bit of water is close enough to entrance to be pumped out. 2nd &amp; 3rd would need battery packs, air pumps &amp; tubes. If depth of 2nd is accurate, would need ~0.5 bar tube pressure. Prob need to enter tube, zip up &amp; then transit."
2018-07-10,Should be very soon. We’ve already made around 100 Model 3 Performance cars for test drives in stores.
2018-07-11,"Definitely. Can’t wait to try that. Been a little distracted past few months on mostly Tesla matters, but back at it soon."
2018-07-12,Just finished an amazing 3 day visit to China. The world has never seen human energy &amp; vigor at such scale. Incredibly impressed with Tesla China team &amp; potential for the future.
2018-07-13,"Whether you plan to buy a Dual Motor Performance Model 3 or not, take it for a test drive anyway. It’s like having pure fun jacked straight into your brain whenever you want."
2018-07-14,"I’m honored to work with an amazing group of people at Tesla, but always happy to talk to an ace who might want to join"
2018-07-20,"Dunno where this bs is coming from. Who knows about the future, but last week we had over 2000 S/X and 5000 Model 3 *new* net orders."
2018-07-21,"Yes, Tesla Model S, X &amp; 3 all automatically keep cabin temperature within safe limits even when parked Phew . Yeah, we had a drain block 3 months ago &amp; people are working hard to make Tesla successful. Am honored to work with them. Are you trolling for fun or is it part of a job? What motivates you?"
2018-07-23,We’ve gone from ~1000 S/X deliveries per week in US last year to ~6000 S/3/X. It’s like hitting a square wave.
2018-07-26,"Worth another retweet. Hope Dan Neil returns to Twitter. He left due to relentless attacks from short-sellers, who constantly peddle fear, uncertainty &amp; doubt about Tesla. Dan won the Pulitzer &amp; is considered by many to be the best car critic in the world."
2018-07-31,"Tesla body shops are ramping up fast. Aiming to go from 30+ days using external body repair shops to same day body repair with prestocked parts at Tesla service centers. Can’t wait to bring Tesla to Brazil. One of my favorite countries! Yeah, Model 3 is designed to fit 6’4” adults comfortably in both front &amp; rear seats at same time We’re adding a “party &amp; camper mode” soon to S/3/X, so your car can maintain air flow, temp, selective lights, music &amp; power devices for 48 hours or more while parked. Big batteries rock … Not having a big gas guzzler engine in front means there’s room for trunks in front &amp; back, plus longer crumple zone for best safety of any midsize car"
2018-08-01,"If you’re into video game development, consider applying to Tesla. We want to make super fun games that integrate the center touch screen, phone &amp; car irl. Good idea &amp; thanks for Supercharger trophy reminder. Really want to make the car as fun as possible! Some of best classic games coming as Easter eggs in Tesla V9.0 release in about 4 weeks. Thanks !"
2018-08-05,"We’re working on a new Tesla mini-car that can squeeze in an adult Model S P100D is def still the top end, but Model 3 Performance is higher value for money Games &amp; other refinements will go to all Tesla S, X &amp; 3 from start of production. Autopilot enhancements apply to all Model 3’s plus S &amp; X made in last few years (needs Autopilot Hardware V2.0 or higher). Glad you’re enjoying Model 3 &amp; thanks for buying a Tesla! Major enhancements to Autopilot &amp; fun games coming in a month with V9.0. Def worth it. Model 3 Performance is next-level. Performance Model 3 review by Dang, turns out even Hitler was shorting Tesla stock … Tesla Autopilot Team"
2018-08-07,Absolutely. Am super appreciative of Tesla shareholders. Will ensure their prosperity in any scenario. Am considering taking Tesla private at $420. Funding secured. My hope is *all* current investors remain with Tesla even if we’re private. Would create special purpose fund enabling anyone to stay with Tesla. Already do this with Fidelity’s SpaceX investment.
2018-08-08,Probably 4 to 6 months. Those who order full self-driving get the upgrade at no cost. It isn’t needed just for enhanced Autopilot. Tesla deliveries &amp; AP hardware chart by at MIT
2018-08-11,"Great Q&amp;A last night. Thanks for helping make Tesla &amp; SpaceX more secure! Planning to open-source Tesla vehicle security software for free use by other car makers. Extremely important to a safe self-driving future for all. Thanks, great feedback. Will be a fun project for Tesla design. Love the idea of adding a special item every few months, so whenever you go into a Tesla store, there is something new &amp; delightful to see. Production design will be better, especially in details. We are dying to do this, but primary focus must remain on making affordable version of Model 3 &amp; bringing Y to market Short shorts coming soon to Tesla merch"
2018-08-12,Model 3 traction testing on pure ice &amp; snow
2018-08-14,"I’m excited to work with Silver Lake and Goldman Sachs as financial advisors, plus Wachtell, Lipton, Rosen &amp; Katz and Munger, Tolles &amp; Olson as legal advisors, on the proposal to take Tesla private"
2018-08-16,Model 3 review by Unbox ... via Missile Command &amp; Lunar Lander already working in dev build. We changed the control mapping for max fun on a touchscreen.
2018-08-18,Super appreciate free concert for Tesla during this intense time!
2018-08-19,Ford &amp; Tesla are the only 2 American car companies to avoid bankruptcy. I just got home from the factory. You think this is an option. It is not.
2018-08-24,"Tesla Car Karaoke hopefully ready in OTA software update version 10. Just played Missile Command, Asteroids &amp; Lunar Lander in V9. Really fun! Goal is to service your car wherever you are, quietly &amp; quickly. No need to bring it to a Tesla service center."
2018-08-25,"This is utterly false. Fossil fuel merchants of doubt have been pushing that bs for years. Tesla Gigafactory will be 100% renewable powered (by Tesla Solar) by end of next year. Most major customers have tried it &amp; love it. Now we need to finish production design &amp; build it, while avoiding dumb mistakes made with Model 3 production system. Wish it wasn’t so hard to be less stupid over time … What’s cool is that it was driven across the country alone (no escort or any accompanying vehicles), using the existing Tesla Supercharger network and an extension cord In talking to our public investors, most were supportive of optimizing for long-term value creation over quarterly earnings. This was also a factor in remaining public."
2018-09-03,"Much appreciated! Great word-of-mouth is why Model 3 is the best-selling electric car, despite no advertising or paid endorsements."
2018-09-06,"Tesla 1st, 2nd &amp; 3rd in August sales"
2018-09-11,"Moving 2 of 7 Tesla colors off menu on Wednesday to simplify manufacturing. Obsidian Black &amp; Metallic Silver will still be available as special request, but at higher price."
2018-09-12,"Due to a large increase in vehicle delivery volume in North America, Tesla customers may experience longer response times. Resolving this is our top priority."
2018-09-14,"The Tesla board has done incredible work overseeing the largest value creation in the auto industry in 100+ years, despite many setbacks. Tesla owes its very existence to this board! Electric cars made with sunlight"
2018-09-15,Tesla owners can grant free Supercharging for life to a friend who buys S/3/X. Ends tomorrow night.
2018-09-16,"Yeah, that’s our problem. Service &amp; parts supply in general will be the top Tesla priority after we get through the insane car delivery logistics of the next few weeks. Exciting to see some Tesla collision repair operations already completing within 24 hrs. Aiming for same day soon, then under an hour. Tesla is bringing most collision repairs in-house, as outside firms take weeks to months for repairs, driving Tesla owners (and us) crazy Outside repair shops are jack of all trades, which means supporting 1000’s of makes &amp; models. Tesla collision repair specializes in three. Having all parts in stock &amp; not waiting for insurance approval also make a world of difference."
2018-09-17,"Good news on this front. Tesla engineering rallied &amp; this will be part of V9. Going through final testing now. Due to some Tesla owners encountering system issues yesterday, the free Supercharging referral program will be extended until tomorrow night Sorry, we’ve gone from production hell to delivery logistics hell, but this problem is far more tractable. We’re making rapid progress. Should be solved shortly. Sorry, it’s not really sustainable at volume production &amp; doesn’t incent optimal behavior. We probably should have ended this earlier."
2018-09-19,Tesla Rangers!
2018-09-20,"Key technical point is that the polar moment of inertia (concentration of mass around center) of a Tesla, to the extent of our knowledge, is better than any other production car. This positively affects safety, handling &amp; driving feel. Extremely important metric. A car propelled by combustion is far more likely to combust than an electric car Tesla piece on the physics of car safety coming soon for those interested in technical details . will post final safety probability stats soon. Model 3 has a shot at being safest car ever tested."
2018-09-22,"Wow, thanks for offering to help! The coming week is incredibly intense. If any current Tesla owners who’d like to help educate new owners could head to Tesla delivery centers during midday on Sat/Sun &amp; morning/evening on weekdays, that would be super appreciated!"
2018-09-25,♥️ Tesla Owners ♥️
2018-09-28,Huge thank you to all Tesla supporters for helping with car deliveries all around the world. You rock!! Sorry for difficulties delivering your Tesla due to high volume! Critical to show that environmentally sustainable is financially sustainable.
2018-09-29,Tesla will deliver your car to you. This is the future. The way it should work.
2018-10-02,"Tesla Autopilot team is awesome! Got to make sure we iron out the details though. Long tail of tricky edge cases. Important to get front wide angle, B pillar &amp; side repeater camera neural nets just right."
2018-10-04,"By revenue, taking publicly available selling prices, Model 3 actually outsold Camry by a factor of two If you think Tesla is overvalued compared to probable value of future cash flows, sell. Otherwise, buy."
2018-10-05,V9 moving to wide release now. Holding back Autopilot drive on navigation for a few more weeks of validation. Extremely difficult to achieve a general solution for self-driving that works well everywhere. Tesla owners can refer someone to buy a Tesla &amp; get any image they want laser etched in glass &amp; sent to deep space for millions of years
2018-10-06,What city &amp; what Model 3 config?
2018-10-07,"Tesla owner shows how well ultrawhite seats hold up after 25,000 miles. The black &amp; white interior is def best imo."
2018-10-08,"The physics of how Tesla achieved best safety of any cars ever tested. Note, when vehicle weight is taken into account, order is more like X,S, then 3, but they are all very close."
2018-10-09,No such thing as a “full refresh” at Tesla or even a model year. Our cars are partially upgraded every month as soon as a new subsystem is ready for production. There is no cadence.
2018-10-11,"Exactly. A Tesla is objectively much safer in a crash than all other cars, according to NHTSA’s *own* calculations. This is just physics!"
2018-10-12,"Tesla exists to help reduce risk of catastrophic climate change, which affects all species on Earth. Even if your faith in humanity is faltering, this is worth caring about. Support makes a difference. Thank you. Teslaquila coming soon …"
2018-10-13,Whole beer keg fits in Model 3 trunk!
2018-10-14,"Thanks for recognizing the great work of the Tesla team! 45,000 people now."
2018-10-15,"This is without the Tesla NN computer. Per my public comments, that will give the car an extra order of magnitude. Model 3 motor &amp; gearbox still in good condition after driving 1M miles. Designed for ultra high endurance. Haha. It is actually my fav game on Tesla cars right now What are some of the most fun games we could have on a Tesla? Classic Atari is just the start."
2018-10-16,The FSD upgrade is the Tesla computer with our NN chip ~6 months before it is in all new production cars. No change to sensors. This is simple replacement of the Autopilot computer. Will be done free of charge for those who ordered full self-driving.
2018-10-17,"New Summon will use the Autopilot cameras True, but this will improve dramatically over next several months &amp; all Tesla cars ever produced (except early Roadsters) will get improvements for free. Continuous, free over-the-air software updates is a big part of why a Tesla retains so much value over time. Just reviewed Tesla’s service locations in North America &amp; realized we have major gaps in geographic coverage! Sorry for this foolish oversight. Tesla will aim to cover all regions of NA (not just big cities) within 3 to 6 months."
2018-10-18,"Model 3 long range, rear wheel drive is still available for ordering off menu for another week or so It’s kind of like the post office. Same price for delivery to Maine as the SF Bay Area. But you do get a free Tesla factory tour, which is really fun to see. Tesla rear wheel drive cars do actually work well on snow &amp; ice. We did our traction testing on an ice lake! Dual motor AWD is great, but not required for cold weather. Just don’t use sport/summer tires. It’s a long range battery with fewer cells. Non-cell portion of the pack is disproportionately high, but we can get it done now instead of ~February Just released lower cost, mid-range Tesla Model 3 &amp; super simple new order page"
2018-10-19,"If you don’t like a Tesla for any reason or no reason, you can just give it back for a full refund"
2018-10-22,"Order Tesla without test drive &amp; you get 3 days to return for refund, else 1 day"
2018-10-23,"Get this question a lot, so need to clarify that there’s no such thing as a Tesla “refresh”. Other car companies do this every ~3 years, but Tesla constantly upgrades vehicle hardware every week. To simplify production, many Tesla Model S &amp; X interior configs, will no longer be available after Nov 1. Order now to be sure of the one you want. Model 3 body design could def be less complex, but, yes, most of weight difference is due to higher safety vs other cars Just did that to correct the front design esthetic of Model S. The nose of an electric car shouldn’t look like a radiator grill opening."
