date,cleanText
2020-09-20,"There’ll be lots of green space around factory, but building itself is continuous. The “open” areas inside are covered. They’re internal semi truck roads inside a giant monolithic building."
2020-09-21,"We intend to increase, not reduce battery cell purchases from Panasonic, LG &amp; CATL (possibly other partners too). However, even with our cell suppliers going at maximum speed, we still foresee significant shortages in 2022 &amp; beyond unless we also take action ourselves. Important note about Tesla Battery Day unveil tomorrow. This affects long-term production, especially Semi, Cybertruck &amp; Roadster, but what we announce will not reach serious high-volume production until 2022. Good analysis, although I think we should wait until FSD is a bit more mature I’m pretty sure Tesla could do a much better autocorrect. The bar is so low haha."
2020-09-22,"The extreme difficulty of scaling production of new technology is not well understood. It’s 1000% to 10,000% harder than making a few prototypes. The machine that makes the machine is vastly harder than the machine itself."
2020-09-23,"Roadster will be better Cybertruck, ATV, Roadster &amp; Semi C A R S"
2020-09-26,"Suppliers. We’re only doing high energy nickel ourselves, at least for now. Also, maybe the presentation wasn’t clear that we’ve actually had our cells in packs driving cars for several months. Prototypes are trivial, volume production is hard. Totally up to you, but if you head to a Tesla delivery center near you &amp; maybe help out new owners, that would be cool Thanks Tesla Team for great work on deliveries! For new owners, we super appreciate accommodating us on delivery timing! Definitely one of our toughest quarters in global logistics."
2020-09-28,"That’s total market, not all Tesla. We do see Tesla reaching 20M vehicles/year probably before 2030, but that requires consistently excellent execution. We aren’t cutting the price of Model 3 to $25k. I was referring to a future car that will be smaller than Model 3."
2020-09-29,Having a low center of gravity makes a world of difference to safety
2020-10-01,The new heat pump in Model Y is what really makes the difference in cold weather
2020-10-03,Vector-space bird’s eye view coming with FSD
2020-10-05,"Turn volume to 11 &amp; play Powerglide in your Tesla FSD will solve these issues Music volume on a Tesla goes to 11, because it’s louder than 10 This article is wildly incorrect about lithium battery costs by a factor of 5 or more presently &amp; 10X long-term"
2020-10-07,"Autopilot team is making great progress. Reality sure is complicated! That would be like licensing Battlestar Galactica. Actually building continuously evolving gargantuan factories is the hard part. Lots of people who worked at Tesla Gigafactories now work at competitors, but none of those companies have made one. Yes, the Gigafactory is the hardest &amp; most critical product Battery pack will be a bonded structure with cells providing shear transfer between steel upper &amp; lower face sheets, eliminating most of the center body parts while providing better torsional rigidity &amp; improved polar moment or inertia. This is a *major* breakthrough. But now we understand production much better. It will be our primary competitive advantage long-term. Even GM &amp; Chrysler went bankrupt in 2009. Ford and Tesla are the only US car companies that have avoided bankruptcy. The Model 3 production ramp was sheer agony for two years, but that was do or die for Tesla. No US car company has reached high volume production with sustained free cash flow in ~100 years. Hundreds of car startups all died or were absorbed for peanuts by big three. Bringing a new product to volume production is 1% inspiration &amp; 99% perspiration. You do still need that critical seed of inspiration, but it’s fun &amp; takes ~100 people. Production takes &gt;10,000 people &amp; hurts like hell until the gigantic cybernetic collective runs smoothly. Prototypes are a piece of cake, but high volume production of a new technology is extremely hard. Takes much longer than people think to climb the production S-curve. I can’t emphasize enough that production is by *far* the hard part. Berlin will use 4680 cell with structural battery pack &amp; front &amp; rear single piece castings. Also, a new paint system. Lot of new technology will happen in Berlin, which means significant production risk. Fremont &amp; Shanghai will transition in ~2 years when new tech is proven."
2020-10-08,"Meant to say that it should be fixed in the latest wide release. Won’t need to wait for FSD. Waymo is impressive, but a highly specialized solution. The Tesla approach is a general solution. The latest build is capable of zero intervention drives. Will release limited beta in a few weeks."
2020-10-10,Great work by SpaceX valve engineering &amp; production!
2020-10-11,"There are sketchy edits to Tesla wiki that whitewash Eberhard’s problems/glorify his role. Pretty odd. I was interim CEO/co-CEO from July 2007. Michael Marks was co-CEO for ~Q4 2007 &amp; Ze’ev Drori for Q1 to ~Q3 2008. After Q3 2008 financing round bust, no choice but to be CEO. When Eberhard was fired from the Tesla CEO role in mid 2007 for providing false information to me &amp; the board, no one left with him. That says it all. SpaceX/Tesla metallurgy &amp; new materials team is next-level"
2020-10-12,"With FSD, we got stuck in a lot of local maximums, which wasn’t clear until we hit the ceiling. This time, it’s right. Sheer magnitude of the entire production system is hard to appreciate. Almost every element of production is &gt;75% automated. Only wire harnesses &amp; general assembly, which are &lt;10% of production costs, are primarily manual. Limited FSD beta releasing on Tuesday next week, as promised. This will, at first, be limited to a small number of people who are expert &amp; careful drivers. Tesla FSD computer’s dual SoCs function like twin engines on planes — they each run different neural nets, so we do get full use of 144 TOPS, but there are enough nets running on each to allow the car to drive to safety if one SoC (or engine in this analogy) fails. We face a tough dichotomy of applying resources to the old architecture or applying them to the new. It’s not a question of money. If there was a “great engineer” factory, we would place a large order! Unfortunately, great engineers are very rare. This is solved in the FSD build."
2020-10-14,"Starting production on 7 seater next month, initial deliveries early December The gauntlet has been thrown down! The prophecy will be fulfilled. Model S price changes to $69,420 tonight! We simplified this a lot. It’s basically just Teslas in tunnels at this point, which is way more profound than it sounds."
2020-10-16,Current production is slightly better
2020-10-20,"FSD beta rollout happening tonight. Will be extremely slow &amp; cautious, as it should."
2020-10-21,"Not intentional! We just wanted to show that you could theoretically convert the entire US vehicle fleet to electric using only the lithium in Nevada, a single state. Tesla will do lithium mining only as needed. We also found a way to extract lithium using NaCl (table salt)."
2020-10-22,"Price change is pushed to Thursday next week. Applies only to US for now. One week clock will start in other countries as beta is released. FSD monthly rental will also be available sometime next year. Now that Tesla FSD beta is out in limited release, FSD price (new or upgrade) will go up by ~$2k on Monday Dependent on proving high safety"
2020-10-23,Great pics! That we now have the beginnings of a Starship production system is most meaningful.
2020-10-24,Visualization will tone down significantly for production. These are intentionally strident colors.
2020-10-27,Tesla team has done great work!
2020-10-29,Tesla should make catgirl robots?
2020-10-31,Thanks to a great Autopilot/AI team working super hard! Doing “neural nets” without testing them against reality has led some groups to overestimate what they’re doing. Reality is the hardest sim.
2020-11-01,Tesla Texas team is making great progress! Giga Texas factory will be an asskicker.
2020-11-02,Didn’t realize that was possible. No problem if there’s a way get current design Cybertruck approved in Europe!
2020-11-03,"Closest we got was about a month. The Model 3 ramp was extreme stress &amp; pain for a long time — from mid 2017 to mid 2019. Production &amp; logistics hell. I put in my last money, even though I thought we would still fail. But, it was either that or certain death for Tesla. Extremely difficult to raise money for an electric car startup (considered super quirky back then), while stalwarts like GM &amp; Chrysler were going bankrupt."
2020-11-05,Recruiting ace engineers for Giga Berlin! Will interview in person tomorrow on site. Send resume to 25Guns.com.
2020-11-06,"Faraday invented the electric motor, Tesla the (commutator-free, three-phase) AC induction motor, in other words, a useful electric motor Maxwell was amazing. Should have more recognition. Tesla Motors, Inc., was almost called Faraday, as it took until late 2004/2005 to buy the trademark from a guy who had had it since 1995."
2020-11-08,Enough already on my plate &amp; Tesla’s. Maybe one day will do a prototype. Those are relatively easy. Volume production with high reliability &amp; low cost &amp; passing all regulations is 100X harder. ♠️♠️ Tesla Autopilot/AI team ♠️♠️
2020-11-09,"I do expect this to become an important product for the world, but probably not financially material for Tesla Tesla makes the RNA Bioreactor that can make vaccines / cures. CureVac has version 2 in use. Version 3 is under development. Thanks to a lot of great Autopilot/AI hardware &amp; software engineers at Tesla! Wait until you see what Cybertruck will do"
2020-11-13,"Technically, I tested positive, then negative twice, then positive again, so “Elon Musk Tests Negative for Covid” is an equally correct title. The “rapid antigen test” from BD seems to be about as useful as a flipping a coin."
2020-11-15,"Dragon can also hover &amp; land propulsively, but we use the parachutes for maximum safety Thrusters are integrated with spacecraft, enabling abort capability all the way to abort for increased safety"
2020-11-16,"CureVac, Moderna &amp; a few others. Tesla makes the machine CureVac uses to go from known gene sequence to trillions of lipid-coated mRNA strands."
2020-11-17,"Absolutely. Production/testing of rocket engines is over 90% of the problem. This is true in general. For cars, production is over 99% of the problem. That 1% inspiration is very important, but it’s less than 1% of the pain. They’re on their way! Hopefully, more Teslaquila next month."
2020-11-18,The only publicly traded stock I own is Tesla Tesla holiday software release is
2020-11-19,Safety is our primary design goal
2020-11-20,"This is a misperception. SpaceX developed &amp; continues to use lidar for Dragon docking with . Just pointless imo for self-driving. If you’re going to do active photon generation, use an occlusion penetrating wavelength, like precision radar at ~4mm. Andrej is awesome, but it should be said that we have a very talented Autopilot/AI team at Tesla. Too much credit comes to me &amp; Andrej."
2020-11-21,"We have quiet a queue of products to build! Better do new Roadster at some point. Tesla is a vehicle for creating &amp; producing many useful products Because I am not an investor. Tesla is definitely not the only good company, but investing is not what I do. But I always put my own money into companies I help create, otherwise it’d be wrong to ask others to do so."
2020-11-24,"Rapid &amp; complete rocket reuse, low cost propellant, orbital refilling &amp; propellant production at destination are the four essential elements of making life multiplanetary We’re still far from simply video in, control out. The biggest game-changer, currently underway at Tesla, is 360 degree, high fps video for labeling, training &amp; inference. FSD Beta 5 coming out in a few days. Improvement should be significant."
2020-11-25,"We will have special colors for new Roadster, as we did for the original"
2020-11-26,"Ok. Overall air suspension height &amp; damping algorithm is getting a lot of attention. Will be linked to FSD, so acts automatically."
2020-12-02,"Award accepted on behalf of the great people at Tesla, SpaceX, Neuralink &amp; Boring Co"
2020-12-15,"Giga Berlin-Brandenburg will be the first to use our new structural pack architecture, 4680 (world’s most advanced cells, made on-site), both front &amp; rear body castings &amp; advanced paint shop. Warning: with so much new technology, production timing is naturally harder to predict."
2020-12-17,"It will get absurdly good. Tesla AI/Autopilot engineering is awesome! There’s some great AI out there, but can it self-drive while playing Cyberpunk … ?"
2020-12-20,Absolutely. We will release FSD subscription early next year.
2020-12-21,"Thanks to everyone who worked so hard to make Tesla successful. My heart goes out to you. They are, although it’s kind low-key. Tesla Superchargers are being made accessible to other electric cars."
2020-12-22,"During the darkest days of the Model 3 program, I reached out to Tim Cook to discuss the possibility of Apple acquiring Tesla (for 1/10 of our current value). He refused to take the meeting. Strange, if true. - Tesla already uses iron-phosphate for medium range cars made in our Shanghai factory. - A monocell is electrochemically impossible, as max voltage is ~100X too low. Maybe they meant cells bonded together, like our structural battery pack?"
2020-12-24,"To Tesla owners taking delivery in the final days of year, your support is super appreciated!!"
2020-12-25,"Engineering, design &amp; general company operations absorb vast majority of my mind &amp; are the fundamental limitation on doing more. Capital allocation is important, but low CPU load. Tesla public company duties are a much bigger factor, but going private is impossible now (sigh). Change your horn sound to , , or holiday jingles with latest Tesla software update!"
2020-12-26,"There are subtle, important, differences between US &amp; Canada traffic rules, but FSD beta will be extended to Canada very soon"
2020-12-27,"Try playing Polytopia in your Tesla! Great game. Multiplayer online version coming soon. Roughly 95% of parts in Tesla Roadster were unique — not in any other product. Unfortunately, since we started out with the (dumb, in retrospect) goal of simply adapting Lotus Elise to electric, we ended up with a 10% too small sports car that seems kinda like a Lotus."
2020-12-28,Just meeting with Larry Ellison to seek some advice. Back working on Tesla end of quarter tomorrow. What should Tesla do with in-car gaming in an autonomous world?
2020-12-29,"All Tesla cars delivered in the final three days of the year will get three months of the Full Self-Driving option for free. Delivery &amp; docs must be fully complete by midnight Dec 31st. No, these are just incremental improvements to the production codebase. FSD build is a fundamental rewrite, not just in the car, but also our video training/labeling software."
2020-12-30,"Production is hard, prototypes are easy. Building ~1000 Starships to create a self-sustaining city on Mars is our mission. Seems odd that the opposition group is from BMW’s home state of Baveria. That‘s very far from Brandenburg, where Tesla is building the Gigafactory. And why would a group that claims to be pro-environment oppose a sustainable energy factory? Aren’t there more important issues?"
2021-01-01,"Dojo isn’t needed, but will make self-driving better. It isn’t enough to be safer than human drivers, Autopilot ultimately needs to be more than 10 times safer than human drivers."
2021-01-02,"Tesla is responsible for 2/3 of all the personal &amp; professional pain in my life combined. But it was worth it. So proud of the Tesla team for achieving this major milestone! At the start of Tesla, I thought we had (optimistically) a 10% chance of surviving at all. Tesla Full Self-Driving will work at a safety level well above that of the average driver this year, of that I am confident. Can’t speak for regulators though."
2021-01-04,Snow falling on Giga Berlin
2021-01-09,"Maybe a Tesla AI day later this year I super support public spaces around our production &amp; launch sites, wherever it can be done safely and securely. When covid passes, we will open up our restaurant to the public &amp; figure out ways to allow limited access to the High Bar. One of the best Tesla Solar Roof installations"
2021-01-14,"Prototypes are easy, volume production is hard, positive cash flow is excruciating"
2021-01-16,Cybertruck doesn’t need a garage
2021-01-18,The rate-limiting part or process in cell production is constantly changing Battery cell production is the fundamental rate-limiter slowing down a sustainable energy future. Very important problem. Looking into this. No question that FSD should be viewed as reasonably valuable when doing a trade-in.
2021-01-23,We’re switching to a more sensible FSD version numbering to distinguish between major &amp; minor updates. Current build is FSD 8.1. It drove me to an unfamiliar location in LA &amp; back last night with no interventions!
2021-01-25,"Yes, although it will be crazy not to turn on FSD Tesla is steadily moving all NNs to 8 camera surround video. This will enable superhuman self-driving. Sorry for the version confusion. V8.1 is what it should say for FSD. Separate version number for rest of car. To my surprise, Tesla has better AI hardware &amp; software than Waymo (money)"
2021-01-28,"Finishing engineering this year, production starts next year. Aiming to have release candidate design drivable late summer. Tri-motor drive system &amp; advanced battery work were important precursors. New Roadster is part rocket First production car ever to achieve 0 to 60 mph in less than 2 seconds Plaid Model S ships next month"
2021-01-29,I sure hope that’s not true at Tesla or SpaceX!
2021-02-01,"Neuralink is working super hard to ensure implant safety &amp; is in close communication with the FDA. If things go well, we might be able to do initial human trials later this year. Giga Berlin progress"
2021-02-04,No need to be a gigachad to own
2021-02-06,Time to tell the story of Tesla &amp; SpaceX
2021-02-09,"Lowest cost per ton of carbon sequestered, net of value of any product made. Must be scalable to gigaton level. Aiming for maximum usefulness. Everyone at Tesla receives stock. My comp is all stock/options, which I do not take off the table. That’s what you’re missing."
2021-02-11,Congratulations Tesla China for amazing execution last year. Now on to the next for even more!!
2021-02-18,SpaceX in south Texas &amp; Tesla in central have been providing direct assistance where feasible (eg save cold turtles &amp; help power the water treatment plant). Please let us know if we may be helpful in other ways.
2021-02-19,"To be clear, I am *not* an investor, I am an engineer. I don’t even own any publicly traded stock besides Tesla. However, when fiat currency has negative real interest, only a fool wouldn’t look elsewhere. Bitcoin is almost as bs as fiat money. The key word is “almost”. Tesla’s action is not directly reflective of my opinion. Having some Bitcoin, which is simply a less dumb form of liquidity than cash, is adventurous enough for an S&amp;P500 company."
2021-02-20,"Most people have no idea, even though there are so many FSD progress videos posted. Munro understood right away. There will be a gap before the next release, but then it will be a step change better. Tesla is solving a major real-world AI problem."
2021-02-22,"It is still available off menu, but I don’t think the range, in many drive conditions, yet meets the Tesla standard of excellence The Tesla Solar Roof is slightly hydrophobic, so water, snow or ice slide off easily"
2021-02-25,"Nickel is our biggest concern for scaling lithium-ion cell production. That’s why we are shifting standard range cars to an iron cathode. Plenty of iron (and lithium)! This is not about winning anyone over. We are production-limited. The reason we are making our own cells is to *supplement* max production of suppliers. Even moving at full speed, they cannot build enough cells. Prices in the US (of all goods) don’t include VAT, but it’s usually included in other countries. Then there’s import duty &amp; transport costs. The intent is that revenue to Tesla is roughly similar in all countries, so taxes, tariffs &amp; transport make up the difference."
2021-02-26,Do androids dream of electric cars?
2021-03-01,"Tesla China team rocks! Note, buying FSD will still be a better long-term deal than subscription"
2021-03-02,Horses are even self-driving!
2021-03-03,FSD beta build V8.1 normally drives me around with no interventions. Next version is a big step change beyond that. Tesla is solving a major part of real-world AI. This is not widely known.
2021-03-04,"Tesla &amp; Ford are the only American carmakers not to have gone bankrupt out of 1000’s of car startups. Prototypes are easy, production is hard &amp; being cash flow positive is excruciating."
2021-03-05,"Tesla AI, both hardware &amp; software, is deeply underestimated"
2021-03-06,"Update probably in Q2. Cybertruck will be built at Giga Texas, so focus right now is on getting that beast built. The Tesla FSD computer started shipping in volume in Q2 2019. 2020 cars should all have FSD computers, whether or not ordered as an option. Availability varies by region due to regulatory approval delays and/or Tesla internal development &amp; testing. Note: word “Beta” is used to reduce complacency in usage &amp; set expectations appropriately. All software is first tested internally by Tesla simulation &amp; QA drive teams. Due to high levels of demand for FSD Beta, adding “Download Beta” button to Service section of car display in ~10 days If you want the Tesla Full Self-Driving Beta downloaded to your car, let us know. Doubling beta program size now with 8.2 &amp; probably 10X size with 8.3. Still be careful, but it’s getting mature."
2021-03-08,"Not connecting Tesla cars to Starlink, as our terminal is much too big. This is for aircraft, ships, large trucks &amp; RVs."
2021-03-09,"Build 8.3 of FSD should be done QA testing by end of next week, so that’s roughly when download button should show up Assuming user approves warning &amp; agrees to drive carefully, it will download latest QA-tested FSD “Beta” build as soon as car connects to wifi"
2021-03-10,Battery energy density is the key to electric aircraft. Autonomy for aircraft could have been done a long time ago. Modern airliners are very close to autonomous.
2021-03-11,"Like , but *with* self-driving haha"
2021-03-12,FSD Beta has now been expanded to ~2000 owners &amp; we’ve also revoked beta where drivers did not pay sufficient attention to the road. No accidents to date. Next significant release will be in April. Going with pure vision — not even using radar. This is the way to real-world AI.
2021-03-14,"Play your favorite song in a Tesla &amp; turn the volume to 11 You will see. You will feel. What has become absolutely clear is that the plethora of self-driving corner cases can only be solved with real-world optical intelligence. This is how humans designed the road system to work. Once you have that in silicon form, everything else is just icing on the cake."
2021-03-18,"Yes, Booster 1 is a production pathfinder, figuring out how to build &amp; transport 70 meter tall stage. Booster 2 will fly."
2021-03-23,I once did a road trip across most of US with 2 adults &amp; 5 kids in a Model S! The new Plaid S is our best car ever. Will be first production car to achieve 0-60mph in under 2 secs &amp; it has four doors &amp; seats up to 7 people.
2021-03-24,"Tesla is using only internal &amp; open source software &amp; operates Bitcoin nodes directly. Bitcoin paid to Tesla will be retained as Bitcoin, not converted to fiat currency. You can now buy a Tesla with Bitcoin"
2021-03-26,I think there is a &gt;0% chance Tesla could be the biggest company Solar has come a long way. Now just needs lots of long-life batteries!
2021-03-27,"This is crazy. Should use Tesla Megapacks for load-leveling the grid. More effective, more reliable and costs less."
2021-03-30,"Agreed! We’re not super far, as Magic Valley Utility can give us almost all wind-power, which will be used for LOX (78% of propellant mass)/N2/argon distillation. We’re also aiming to increase solar power from 1MW to 10MW, paired with Tesla Megapacks, for continuous power. Next major technology rev is at SN20. Those ships will be orbit-capable with heat shield &amp; stage separation system. Ascent success probability is high. However, SN20+ vehicles will probably need many flight attempts to survive Mach 25 entry heating &amp; land intact. A high production rate solves many ills Demand is no problem, but near-term cell supply makes it hard to scale Semi. This limitation will be less onerous next year."
2021-03-31,"Over 10,000 people are needed for Giga Texas just through 2022! - 5 mins from airport -15 mins from downtown - Right on Colorado river"
2021-04-02,Major new Supercharger station coming to Santa Monica soon! Hoping to have 50’s diner &amp; 100 best movie clips playing too. Thanks Santa Monica city!
2021-04-05,Special mention of Tesla China Great work by Tesla team!
2021-04-08,Thanks Tesla suppliers for providing us with critical parts!
