date,cleanText
2023-05-08,"More importantly, there are lots of mounting points for third party hardware on Cybertruck Prototypes are easy, production is hard and achieving positive cash flow is excruciating We always prioritize safety over smoothness. After we achieve a higher tier of safety, then we polish the experience. Very important to both both safe and smooth for new users to be comfortable with FSD. The awareness of the capability of FSD is still shockingly low, even among Tesla owners Once FSD is super smooth (not just safe), we will roll out a free month trial for all cars in North America. Then extend to rest of world after we ensure it works well on local roads and regulators approve it in that country. RT : Tesla Lithium Groundbreaking Ceremony RT : Tesla Lithium Refinery groundbreaking will be streamed live on Twitter at 3 PM CDT RT : First Model Y deliveries in Türkiye"
2023-05-10,"As mentioned earlier, v11.4.1 has major architectural improvements. It’s actually much more than a point release. Should arguably be v12.0, but that’s reserved for when FSD is fully AI from video in to control out. Congratulations Tesla Texas Team!! RT : Vote at the 2023 Tesla Shareholder Meeting →"
2023-05-11,RT : Powerwall now available in Spain →
2023-05-12,"Obviously, bringing on Linda allows me to devote more time to Tesla, which is exactly what I will be doing!"
2023-05-16,"Tesla shareholder meeting underway This is idiotic on so many levels: 1. That cretin never advised me on anything whatsoever. 2. The notion that I would need or listen to financial advice from a dumb crook is absurd. 3. JPM let Tesla down ten years ago, despite having Tesla’s global commercial banking Tesla Powerwall does the seem for individual homes (if you have the backup switch installed)"
2023-05-17,"Cybertruck option packages &amp; third-party add-ons will be All real &amp; hot of the presses. Tesla Optimus team cranked super hard through the weekend to get it done. They are awesome! RT : Once you’ve tasted the full phone to car and technological experience of a Tesla you can’t go back to any other cars. The… RT : ""A lot of people still think Teslas are super expensive...but now we're at the point where the starting point of a Tesla is actua…"
2023-05-18,"The Tesla AI/software team is truly exceptional &amp; I never give false praise And I will review the audit personally. If you drive a Tesla, you should be able to believe in it to your core. Regulatory oversight of AI is important to protect the public from companies potentially cutting corners on safety"
2023-05-23,And Tesla has Sentry Mode We’re working hard to get Cybertruck into production! This was a tough product to design &amp; even tougher to build. But it will be great …
2023-05-26,You should try Tesla self-driving RT : Excited to welcome Ford owners to thousands of Superchargers across North America next year⚡️✌️
2023-05-27,"Just tap the button for FSD Beta RT : Celebrated with 10k+ employees &amp; their families at Giga Berlin Family Day 🤘 RT : Regenerative braking enables you to bring your Tesla to a complete stop without using the brake pedal, maximizing efficiency &amp; r… RT : Thank you to Tesla owners for making Model Y the world’s bestselling car in Q1 this year!"
2023-06-01,"Congratulations to Giga Shanghai &amp; Tesla China SDS teams for their excellent work overcoming many obstacles over many years!! RT : Powerwall is one of the best products I've ever purchased. Nothing but sunny blue skies for over a week, yet power is out f…"
2023-06-02,"RT : BREAKING: says ALL new Model 3 vehicles in the US now qualify for the full $7,500 EV tax credit, meaning the Mode…"
2023-06-03,"Congrats Tesla Plaid racing team! Tesla is prioritizing safety over comfort for FSD beta. As we become confident in the former, the latter will follow."
2023-06-05,"Tesla aspires to be as helpful as possible to other car companies. We made all our patents freely available several years ago. Now, we are enabling other companies to use our Supercharger network. Also happy to license Autopilot/FSD or other Tesla technology. Thank you for recognizing concerns about safety of digital superintelligence, which affects all of humanity RT : Dragon separation confirmed; autonomous docking with the on Tuesday, June 6 at ~5:50 a.m. ET"
2023-06-07,"We are working on having this information will show up on your profile, so you know exactly what applies to your account. Not as easy as it sounds, because there are many different systems at Twitter that affect accounts, especially in “Trust and Safety” software layer. The Tesla Plaid Model S is incredible"
2023-06-08,"Thank goodness! North America will have a way better connector for charging cars than rest of world. Model 3 &amp; Y have great air filtration too, but they’re too small to fit the monster HEPA filters Tesla Model S &amp; Model X have hospital-grade HEPA air filters, protecting you from dust, bacteria, pollen (allergies), spores &amp; many toxic gases"
2023-06-09,"We tried very hard to get EU to consider the Tesla (now NACS) design, as it is fundamentally better in every way for consumers, but the transport minister said “a committee decided the standard years ago” (sigh). Worth mentioning that Tesla is supplying the adapter &amp; other"
2023-06-11,"If is serious about freedom of speech, then we have common ground. But destroying public safety by electing DAs who won’t prosecute violent criminals needs to stop."
2023-06-14,"We built the Supercharger network out of desperation, since no one else was doing it"
2023-06-19,"Ok, I will ask Tesla &amp; SpaceX to inquire further"
2023-06-20,"Super exciting work happening at Tesla in AI software, chip design &amp; robots!"
2023-06-21,"Not exactly a competitor to Nvidia, as we aren’t selling Dojo computers (although it could be sold as service). We just need a crazy amount of training compute to get full self-driving 10X safer than human, but can’t get enough GPUs, plus prices are extremely high! They claim to have a “wall” between news &amp; advertising, but reporters know full well who butters their bread. For example, there were nonstop bogus articles about electric cars on fire, even though they’re 500% to 1000% less likely to burn than combustion engine cars. As soon"
2023-06-22,"Tesla AI, both software &amp; hardware, is far more advanced than even most experts realize Ah yes, that is coming. We prioritize safety before convenience."
2023-06-30,"Please advise people to be wary of margin loans. Tesla has always been a high variability stock, often with no obvious rhyme or reason. We are confident about long-term value creation, but cannot control the manic-depressive nature of the stock market."
2023-07-01,"Tesla is shifting emphasis to diffusion for compute efficiency, but will probably drop even that. No company is anywhere close to Tesla in useful AI compute per Watt."
2023-07-08,Just drove Cybertruck around Austin!
2023-07-11,"Btw, your Tesla can protect you from a bioweapon attack"
2023-07-15,Scary Boston Dynamics robot videos is why Tesla is making Optimus
2023-07-17,"Tesla has been focused on this for many years, given the extreme energy constraints of an electric car vs a data center"
2023-07-18,"Well, at least SpaceX/Starlink and Tesla have significantly increased US production over that timeframe"
2023-07-19,They were instrumental to the success of Giga Berlin “Tesla sued by reality for stealing its data”
2023-07-23,"Accurate. [Technical note: Linux in 1999 was still early days, whereas Windows had a whole video game dev community to draw upon. In later years with SpaceX &amp; Tesla, I obviously went with Linux. Also, Max was unequivocally wrong that the site wouldn’t work with Windows. It You have the “invests in Tesla” part wrong. Do I look like Warren f* Buffett to you? Now ask the Tesla AI"
2023-07-24,Same happens with Tesla FSD. I forget that most people on Earth have no idea cars can drive themselves.
2023-08-01,"Vehicle control is the final piece of the Tesla FSD AI puzzle. That will drop &gt;300k lines of C++ control code by ~2 orders of magnitude. It is training as I write this. Our progress is currently training compute constrained, not engineer constrained. Thank you for visiting with us at Tesla HQ"
2023-08-02,"Was buried in Tesla work all day, so unfortunately missed out, but that is good to hear So long as this platform is not boring, it will succeed. Indeed, many parts of the world are reaching high peak levels of renewable energy production! Due to the obviously intermittent nature of wind and solar power, the limiting factor for renewable energy growth is increasingly stationary battery packs at utility scale."
2023-08-05,"I wonder what kind of hotel we would design if we did so. Our Tesla futuristic diner (Grease meets The Jetsons with Supercharging) in LA should be ready later this year. Interest in ad rev share by content creators has far exceeded our expectations, so will take a few more days to process. Major payouts coming soon! Thanks for everything you’ve done for Tesla!"
2023-08-06,Would be cool to see Cybertruck tackle this
2023-08-07,I would like to thank Zach Kirkhorn for his many contributions to Tesla over the course of 13 often difficult years. Much appreciated and best wishes for the next stage of his career.
2023-08-09,"This is important and fair to advertisers. They don’t have a right to censor this platform, but they absolutely do have a right to say what content appears next to their ads. That said, I would recommend advertisers not be super concerned about content adjacency. Tesla and"
2023-08-11,"Tesla shorts sure are gluttons for punishment! I mean, how many times do they want to do this!?"
2023-08-14,"Tesla FSD test, X Livestream test &amp; attempted Zuck fight triple header!!! For the Tesla FSD test drive in Palo Alto tonight, I will ask the car to drive to ’s house. Will also test latest X livestream video, so you can monitor our adventure in real-time! If we get lucky and Zuck my actually answers the door, the fight is on!"
2023-08-16,Tesla &amp; SpaceX/Starlink doing our best to be helpful to Hawaii Most large AI systems are currently extremely wasteful with how much energy is spent on data transfer (moving same bits around) vs compute. Tesla estimate is that at least an order of magnitude improvement is possible.
2023-08-17,"Sorry it’s taking so long. There are so many layers of “trust &amp; safety” software that it often takes us hours to figure out who, how and why an account was suspended or shadowbanned. A ground up rewrite is underway that simplifies the X codebase dramatically. He could’ve invested in Tesla when we were worth basically nothing and didn’t"
2023-08-18,Tesla Megapacks can solve this
2023-08-22,"Tesla Model S Plaid will do 0 to 60mph (~100km/h) in 2 seconds It is unfortunately trending that way for many automakers. Some companies do understand, but their pace of change is nonetheless slow. Tesla is trying to be as helpful to other carmakers as possible with the transition to autonomous electric vehicles: we open source our patents,"
2023-08-23,"I would just move my desk around the factory to wherever the biggest problem was. These days, I don’t have a desk, but the room I use for meetings at HQ overlooks the Model Y end of line. Just drove the production candidate Cybertruck at Tesla Giga Texas!"
2023-08-25,And she is anti-Semitic
2023-08-26,"It is very easy! 11.4.7, which is mostly, but not entirely, AI is with Tesla employees and a few external users. Rolls out to anyone who bought FSD in the North America next week. An accurate assessment. What is also mindblowing is that the inference compute power needed for 8 cameras running at 36FPS is only about 100W on the Tesla-designed AI computer. This puny amount of power is enough to achieve superhuman driving! It makes a big difference that we"
2023-08-27,"Having a vast fleet of cars for FSD Autopilot training is a massive Tesla advantage. Essential for the hundreds of millions of unusual situations cars encounter on roads every year. HW4 software will lag HW3 by at least another six months, as our focus needs to be on getting FSD on HW3 working super well and provided internationally. Designing in the cameras, liquid-cooled Tesla computer (always go liquid-cooled!) and high security internet gateway will probably take major car companies about three years. Might as well start now! We want to be helpful, as we were with making our patents available for free, True, it was super hard to do this! Even when FSD is 2X as safe as the average human driver fully unsupervised in all scenarios, then we will want to make it 3X, 4X … 10X. About a million people die every year in automotive accidents and ~10 million are seriously injured."
2023-08-30,"Total game changer. If you haven’t tried Tesla Autopilot, you don’t know how awesome it is."
2023-08-31,"Training compute should soon not be so much of a limiting factor. Very difficult bringing the 10k H100 cluster online btw. Similar experience to bringing our now 16k A100 cluster online. Uptime &amp; performance are low at first, then improve with lots of work by Tesla &amp; Nvidia."
2023-09-01,Tesla AI can see incredibly well
2023-09-04,"To clear our platform’s name on the matter of anti-Semitism, it looks like we have no choice but to file a defamation lawsuit against the Anti-Defamation League … oh the irony! ADL has pushed hard for us to shut down accounts like Chaya’s, even though it has nothing to do with anti-Semitism, which is their supposed charter! Since the acquisition, The has been trying to kill this platform by falsely accusing it &amp; me of being anti-Semitic The ADL, because they are so aggressive in their demands to ban social media accounts for even minor infractions, are ironically the biggest generators of anti-Semitism on this platform!"
2023-09-05,"Thanks. Indeed, the ADL pursues a far left political agenda, rather than focusing on combating anti-Semitism."
2023-09-06,"Because the answer is “Yes!” regarding seeking donations, hence JG’s refusal to answer the question. JG instead went on the attack, implying that Sorkin, despite being Jewish, is somehow an anti-Semite just for asking a basic conflict-of-interest question! 🤣 Managing that data is extremely difficult. We ignore (don’t store at all) or delete almost all of it. The training videos that matter are rare ones, like weird &amp; busy intersections, so less than 1% of all videos. Tesla is limited by AI training compute. Nvidia + Dojo fix it."
2023-09-07,"They’ve gone so far from simply combatting antisemitism and now push a far left agenda that has nothing to do with Judaism Accurate. By veering into being a far left activist organization, the ADL is undermining its core mission of fighting anti-Semitism."
2023-09-08,"Among other things, ADL wanted this platform to permanently ban Trump, even though roughly half the country voted for him. What exactly does banning Trump have to do with fighting antisemitism!? PW3 is optimized for ease of installation &amp; high power, which means that a single Powerwall can serve as an uninterruptible power supply for most homes. This is a big deal for ensuring that the lights stay on and you can power all your devices in the event of a power outage."
2023-09-09,"Prototypes are easy, production is hard. Any given conflict comes down to number of combat units times kill ratio. US military vulnerability is primarily due to slow production rates, as we’re seeing in Ukraine."
2023-09-10,"If they don’t switch to autonomous electric cars pronto, that is absolutely true A long tail of training data – reality has a vast number of weird edge cases – is required to solve self-driving well"
2023-09-11,"Just so that the public understands: Taking out a short position against Tesla, as Gates did, results in the highest return only if a company goes bankrupt! Gates placed a massive bet on Tesla dying when our company was at one of its weakest moments several years ago. Such a Almost all of Tesla’s value long-term will be from AI &amp; robots, both vehicle &amp; humanoid Production is a hard problem Gates also said the Tesla Semi was impossible, even though it was literally being driven all over the country. When I asked what battery Wh/kg and truck Wh/mile he was using to reach the conclusion that it’s impossible, Gates had no idea, but still stuck with his conclusion. 🤷‍♂️"
2023-09-13,"Yup. I’d already seen Covid come &amp; go early in 2020 in China. Tesla China had ~20k employees &amp; contractors, yet none died or had near death experiences. While one could debate the accuracy of official statistics, Tesla certainly knew the health status of its own team."
2023-09-14,"Walter spent a lot of time with me in meetings, but much less time walking the factory floor. Tesla and SpaceX factories have a great vibe. We encourage playing music and having some fun. Very important for people to look forward to coming to work! We pay more than the UAW"
2023-09-17,"Gates must have had technical understanding at some point in his career, but has now left planet Earth. He kept speaking nonsense about how long range Semi was impossible, so I asked what his assumptions were for Wh/Mile of the vehicle and Wh/kg for the battery. He did not know. Congratulations Tesla Team! That’s a lot of cars."
2023-09-21,No other choice. The influx is so gigantic that it is overwhelming even major cities like New York.
2023-09-22,How do people keep figuring out that it’s a Cybertruck under the cover!? I just drove the performance Cybertruck today and it kicks ass next-level Don’t mess with Tesla!
2023-09-26,Kids love Cybertruck
2023-09-29,Almost all of it is vestigial. “Trust &amp; Safety”.
2023-10-01,"Such a silly metric. It’s not a giant pile of cash. I really just own stock in the companies that I was instrumental in creating. Technically, I “lose” way more than that every time Tesla stock randomly drops. Great pic of me next to Cybertruck!"
2023-10-03,"New Tesla safety feature uploaded via over the air software update. Your car just got better while you slept. I reported to Bruce Leak, who, many years later, was one of the first to buy a Tesla"
2023-10-04,"More affordable version (RWD) version of Model Y is now available. Note: it performs well on snow &amp; ice with all-season or winter tires. AWD is nice to have, but not required for winter driving."
2023-10-06,I stole the Tesla product roadmap from Spaceballs Sometimes they question if I should even run Tesla. My response is simply which CEO on that list would you prefer?
2023-10-11,All Tesla Superchargers in Israel are free
2023-10-12,This is not cool. Who is funding this organization that spouts so much racism and antisemitism?
2023-10-14,"Car just drove me around Austin all day with no interventions required, despite ACL festival crowds! In the fairly near future, people will wonder why there was ever skepticism about self-driving."
2023-10-15,Yes. End-to-end FSD is the same.
2023-10-23,You can empty the drum magazine of a Tommy Gun and still not penetrate the Cybertruck
2023-10-26,Safety of people should be paramount
2023-10-31,Joe Rohan shatters an arrow on Cybertruck that would easily go through a normal car
2023-11-01,"The irony is that if Autopilot had been turned on here, it would almost certainly have saved the driver"
2023-11-03,"Tesla team is awesome: take pride in working hard, build great products and are good-hearted people. At Giga Berlin today to congratulate the team on their excellent progress. The factory looks amazing! We are going to cover all the concrete with art."
2023-11-04,"Provided our vehicle AI computer is able to run the model, Tesla will probably have the most amount of true usable inference compute on Earth. Even in a robotaxi future, the cars will only be used for ~1/3 of hours/week, leaving 2/3 for distributed inference, like SETI."
2023-11-12,Too bad he didn’t invest in Tesla when it was 0.1% of today’s value lol
2023-11-14,"It was an honor to have you visit Tesla! My apologies for not being able to travel to California today, but I look forward to meeting at a future date."
2023-11-19,"Very important for the public to know why the board felt so strongly about their actions. If it was a matter of AI safety, that would affect all of Earth. This past week, there were hundreds of bogus media stories claiming that I am antisemitic. Nothing could be further from the truth. I wish only the best for humanity and a prosperous and exciting future for all. Tesla was insanely messed up at its founding, but is now worth ~$750B. Also, while I have immense respect for Peter’s intellect, he did explicitly pass on funding Tesla at a $70M valuation, despite being offered priority."
2023-11-20,Starship Flight 3 hardware should be ready to fly in 3 to 4 weeks. There are three ships in final production in the high bay (as can be seen from the highway).
2023-11-22,"Cybertrucks are on their way to Tesla stores in North America! If you want to try a Tesla for a few days, you can rent one This does seem like a compelling argument, but must go through a formal Tesla board process and independent valuation All design &amp; engineering of the original Roadster is now fully open source. Whatever we have, you now have. OpenAI being (semi) independent is probably better for the world than merging with Microsoft. Less concentration of power. Will discuss with Tesla Board They are pure evil. How utterly absurd that this organization got major advertisers to boycott our platform for bogus allegations of antisemitism! Could make them faster, but engine production is not the limiting factor. I’m very excited about the next-gen Raptor engine that is robust enough not to require a heat shield. Will also have more thrust, higher Isp and many other improvements."
2023-11-23,"Supervised FSD is vastly safer than human driving. Unsupervised FSD is trending well. Over time, Version 12 (end-to-end neural nets) will far exceed human safety even when unsupervised."
2023-11-24,"Good point. Fortunately, we have a lot of phosphorus on Earth! It is one of the main elements in LFP lithium batteries."
2023-11-28,"Cybertruck deliveries start on Thursday I’m philosemitic, if anything!"
2023-11-30,"Massive congrats to the incredible Tesla team, from design through to manufacturing, for making Cybertruck real! I love you. “All your based are belong to us” – Cybertruck First Cybertruck deliveries in 2 hours! Cybertruck production line"
2023-12-02,Tesla has by far the best real-world AI
2023-12-03,"If antisemitism is the issue, as they claim, then other platforms are much worse, so that cannot be the real reason"
2023-12-05,"Yes, we are highly confident that Cybertruck will be much safer per mile than other trucks, both for occupants and pedestrians"
2023-12-06,Rainbow as seen from Tesla Palo Alto Cybertruck is a technology discontinuity
2023-12-08,Teslas can charge from solar panels even if the world goes fully Mad Max and there is no more gasoline!
2023-12-11,SpaceX and Tesla have noticed a meaningful degradation in the capability of US college graduates over the past several years
2023-12-16,Imagine if you could see in all directions simultaneously and never get distracted or tired. How much better could you drive? That what Tesla’s Autopilot vision AI is becoming.
2023-12-18,Cybertruck in Wyoming Winter
2023-12-19,We are going to offer a mod package that enables Cybertruck to traverse at least 100m of water as a boat. Mostly just need to upgrade cabin door seals.
2023-12-20,Cybertruck does distill the essential elements of a vehicle
2023-12-24,"Let’s not forget the White House giving Tesla the cold shoulder, excluding us from the EV summit and crediting GM with “leading the electric car revolution” in the same quarter that they delivered 26 electric cars (not a typo) and Tesla delivered 300 thousand."
2023-12-28,He has the wrong frame of reference. Tesla is an AI/robotics company.
2023-12-29,"Next week, I will do a company talk for SpaceX, followed later by a company talk for Tesla after the 10K. I will recap the talented team’s amazing accomplishments of 2023 and describe exciting plans for 2024 and beyond! These will be posted publicly to and . Yay Sweden !! Thanks to the excellent Tesla team in Sweden! Congrats on a great year by all Tesla factories! It is increasingly clear that all roads lead to AGI. Tesla is building an extremely compute-efficient mini AGI for FSD."
2023-12-30,"Cybertruck is necessarily lowest priority for FSD, as there only a few hundred Cybertruck in the field compared to ~5 million other Teslas I stand by my prediction that, if Tesla executes extremely well over the next 5 years, that the long term value could exceed Apple and Aramco combined"
2024-01-02,Congratulations Tesla team on a great year!!
2024-01-03,Tesla is an AI/robotics company that appears to many to be a car company This is how we create Tesla products
2024-01-08,"Great work by the Tesla team! … while simultaneously leading Tesla to be the world’s most valuable car company (Model Y is the selling vehicle on Earth) and SpaceX to be the world’s most valuable space company (~80% of all payload to orbit last year). Whatever I’m doing, I should obviously keep doing it!"
2024-01-09,"Yeah, I was running on very little sleep for several days due to extreme work requirements. Worth noting that Tesla was very close to bankruptcy in 2017."
2024-01-10,Do you want to fly in an airplane where they prioritized DEI hiring over your safety? That is actually happening.
2024-01-11,Credit to the Tesla team Improved Model 3 now available
2024-01-12,Several little Easter eggs in Cybertruck It was wild when Tesla exceeded the Exxon market cap
